company,title,location,url,job_id,timestamp,source
Amazon,"Maintenance Supervisor, Reliability Maintenance Engineering",,https://www.amazon.jobs/en/jobs/2804880/maintenance-supervisor-reliability-maintenance-engineering,,2025-02-26 11:40:06,Amazon
Amazon,"Business Intelligence Engineer (BIE), IMDb",,https://www.amazon.jobs/en/jobs/2902847/business-intelligence-engineer-bie-imdb,,2025-02-26 11:40:06,Amazon
Amazon,"Program Manager II, A-to-z Guarantee",,https://www.amazon.jobs/en/jobs/2868580/program-manager-ii-a-to-z-guarantee,,2025-02-26 11:40:06,Amazon
Amazon,"Business Intelligence Engineer, Amazon Grocery Data and Tech",,https://www.amazon.jobs/en/jobs/2890617/business-intelligence-engineer-amazon-grocery-data-and-tech,,2025-02-26 11:40:06,Amazon
Amazon,"Sr. BIE, Amazon Grocery Data and Tech",,https://www.amazon.jobs/en/jobs/2890614/sr-bie-amazon-grocery-data-and-tech,,2025-02-26 11:40:06,Amazon
Amazon,"Programmer/Analyst, Ship With Amazon",,https://www.amazon.jobs/en/jobs/2908953/programmer-analyst-ship-with-amazon,,2025-02-26 11:40:06,Amazon
Amazon,"Programmer/Analyst, Ship With Amazon",,https://www.amazon.jobs/en/jobs/2907118/programmer-analyst-ship-with-amazon,,2025-02-26 11:40:06,Amazon
Amazon,"Business Intelligence Engineer, Japan Consumer Innovation (JCI), Data Services & Technologies",,https://www.amazon.jobs/en/jobs/2911674/business-intelligence-engineer-japan-consumer-innovation-jci-data-services-technologies,,2025-02-26 11:40:06,Amazon
Amazon,Network Scaling Technician I,,https://www.amazon.jobs/en/jobs/2687961/network-scaling-technician-i,,2025-02-26 11:40:06,Amazon
Amazon,"Senior Business Intelligence Engineer, JP Retail Science",,https://www.amazon.jobs/en/jobs/2911689/senior-business-intelligence-engineer-jp-retail-science,,2025-02-26 11:40:06,Amazon
